{"summary":"Implemented and validated an ABI-preserving runtime-guarded fast path. The guard uses checked integer-address ranges under the recorded flat-uintptr x86-64 policy, dominates bound caching, and routes uncertain/overlapping cases to the original pointer-loaded loop. No commit was created.","files_inspected":["README.md","CMakeLists.txt","include/whyvec_demo.h","src/kernel.c","src/ffi.c","tests/test_kernel.c",".whyvec/agent-packets/wv_32c56bc2e71e77ee21ce19aa.json",".whyvec/analyses/wv_32c56bc2e71e77ee21ce19aa/report.json",".whyvec/analyses/wv_9fb51bb02f1fd54d7ede9d29/report.json","build/whyvec-validation/report.json","build/whyvec-final-validation/report.json",".whyvec/actions/codex-guarded-trace.json"],"alternatives":[{"strategy":"retain_original","decision":"rejected","reason":"The guarded candidate passed correctness gates and showed measured improvement for all five material benchmark sizes."},{"strategy":"global restrict","decision":"rejected","reason":"The public FFI boundary has uncertain external callers, and an intentional overlapping caller exists."},{"strategy":"unconditional bound caching","decision":"rejected","reason":"It changes behavior when output writes modify the pointer-loaded bound."},{"strategy":"guarded_runtime","decision":"selected","reason":"Checked runtime enforcement safely supports caching only on the fast path while preserving the original fallback."},{"strategy":"API change","decision":"rejected","reason":"The runtime guard preserves the existing ABI without broader API changes."},{"strategy":"refuse","decision":"not selected","reason":"All required correctness, sanitizer, compiler-record, performance, and evidence-linkage gates passed."}],"files_changed":["src/kernel.c","CMakeLists.txt","tests/test_differential.c","tests/benchmark.c","tools/validate.py","tools/assert_opt_records.py","tools/analyze_benchmark.py",".whyvec/candidates/codex-kernel.c",".whyvec/actions/codex-guarded-trace.json"],"commands":[{"command":"whyvec replay-opt …/wv_32c56bc2e71e77ee21ce19aa/report.json; whyvec replay-obligation …/wv_9fb51bb02f1fd54d7ede9d29/report.json","outcome":"Passed repeatedly with matching semantic digests."},{"command":"cmake --build build && ctest --test-dir build --output-on-failure","outcome":"Original untouched build and 1/1 original tests passed; final build and 2/2 tests passed."},{"command":"cmake --build build --target whyvec_validate","outcome":"Passed all 11 retained validation commands, both for the staged digest-linked candidate and final source."},{"command":"python3 …/plan_action.py --packet … --validation-report … --candidate-source …","outcome":"Passed; selected_action was validated_guarded_runtime."},{"command":"python3 -m jsonschema -i .whyvec/actions/codex-guarded-trace.json …/whyvec-agent-trace.schema.json","outcome":"Passed action-trace schema validation."},{"command":"clang-21 -Wall -Wextra -Werror …","outcome":"Production kernel and differential validation compiled cleanly; differential execution passed."},{"command":"git diff --check","outcome":"Passed."}],"validation":["Generated defined-behavior differential corpus: 1,127 executions, including zero, negative, VF=8 boundaries, scalar tails, every positive count 1–257, bound before/inside/end/after output, overlap in both directions, 16 aligned layouts, and two checked uintptr boundary refusals.","Explicit witnesses observed 1,123 fast-path and 4 fallback executions.","ASan/UBSan repeated the full 1,127-execution corpus cleanly; the production wrapper test also passed under both sanitizers.","Structured LLVM YAML observed the exact fast loop as Vectorized with VF=8/IC=4 and the exact fallback loop as UnsupportedUncountableLoop plus MissedDetails.","Seeded benchmark used eight sizes, seven warmups, randomized paired ordering, and 31 raw samples per size. All five sizes from 257–65,536 passed the three-times-summed-MAD separation rule; linked material-size median ratio was 8.20×.","Final src/kernel.c SHA-256 is 8e6490d23439e1f2b362bc24799443a9b4549557b7da94bdf4f538429431d5cf, matching the candidate and linked validation/action trace."],"evidence_language":["observed: Clang 21 missed the original loop as uncountable under the recorded configuration.","tested sufficient assumption: isolated parameter.count.noalias changed the matched loop to vectorized; this is not asserted as a caller contract.","validated on covered executions: the guarded candidate matched the original pointer-loaded implementation across the stated corpus and sanitizer executions.","observed: the final fast path vectorized and the preserved fallback remained missed in structured optimization records."],"residual_risks":["Covered executions do not establish formal semantic equivalence.","The integer-address guard is intentionally limited to the recorded flat_uintptr_x86_64 policy.","External FFI callers remain uncertain, which is why no global restrict promise was introduced.","Benchmark results apply to the recorded machine, compiler, flags, and zero-addend overflow-safe workload; the eight-element case showed no material improvement."]}
